{
 "t": 156,
 "clock": {
  "day": 0,
  "minute_of_day": 780,
  "dow": 0
 },
 "layout_version": 1,
 "patients": {
  "id": [
   1,
   2,
   10,
   17,
   24,
   25,
   27,
   35,
   38,
   43,
   46,
   47,
   50,
   51,
   52,
   53,
   54,
   55,
   56,
   57,
   58,
   59,
   60,
   61,
   62,
   63,
   64,
   65,
   66,
   67,
   68,
   69,
   70,
   71,
   72
  ],
  "acuity": [
   3,
   4,
   4,
   4,
   4,
   3,
   3,
   3,
   2,
   4,
   4,
   4,
   3,
   4,
   5,
   4,
   4,
   2,
   2,
   4,
   4,
   3,
   2,
   3,
   4,
   4,
   3,
   3,
   3,
   3,
   3,
   3,
   1,
   3,
   3
  ],
  "condition": [
   8,
   2,
   6,
   7,
   1,
   6,
   8,
   6,
   6,
   5,
   4,
   3,
   5,
   0,
   5,
   6,
   3,
   0,
   8,
   2,
   5,
   4,
   6,
   0,
   8,
   8,
   5,
   3,
   4,
   1,
   4,
   6,
   3,
   6,
   8
  ],
  "state": [
   9,
   9,
   9,
   9,
   9,
   9,
   9,
   9,
   9,
   9,
   7,
   9,
   9,
   11,
   7,
   7,
   7,
   7,
   7,
   7,
   7,
   6,
   4,
   4,
   4,
   3,
   4,
   3,
   3,
   4,
   3,
   2,
   2,
   1,
   1
  ],
  "exit": [
   0,
   0,
   0,
   0,
   0,
   0,
   0,
   0,
   0,
   0,
   0,
   0,
   0,
   1,
   0,
   0,
   0,
   0,
   0,
   0,
   0,
   0,
   0,
   0,
   0,
   0,
   0,
   0,
   0,
   0,
   0,
   0,
   0,
   0,
   0
  ],
  "room": [
   12,
   12,
   12,
   12,
   12,
   12,
   12,
   12,
   12,
   12,
   20,
   12,
   12,
   29,
   35,
   32,
   22,
   21,
   33,
   19,
   17,
   10,
   16,
   27,
   28,
   34,
   18,
   23,
   24,
   26,
   15,
   1,
   1,
   2,
   2
  ],
  "x": [
   21.25,
   42.25,
   22.75,
   27.25,
   36.25,
   39.25,
   12.25,
   22.75,
   24.25,
   45.25,
   51.75,
   19.75,
   39.25,
   55.95,
   17.55,
   4.95,
   60.15,
   55.95,
   9.15,
   47.55,
   39.15,
   67.75,
   34.95,
   47.55,
   51.75,
   13.35,
   43.35,
   64.35,
   34.95,
   43.35,
   73.75,
   19.25,
   17.75,
   26.75,
   26.75
  ],
  "z": [
   7.75,
   7.75,
   7.75,
   7.75,
   7.75,
   7.75,
   7.75,
   7.75,
   7.75,
   7.75,
   34.75,
   7.75,
   7.75,
   48.75,
   26.75,
   26.75,
   34.75,
   34.75,
   26.75,
   34.75,
   34.75,
   19.75,
   34.75,
   48.75,
   48.75,
   26.75,
   34.75,
   34.75,
   48.75,
   48.75,
   51.75,
   45.25,
   46.75,
   42.75,
   42.75
  ],
  "age_min": [
   745,
   735,
   610,
   495,
   420,
   410,
   360,
   205,
   185,
   145,
   140,
   135,
   120,
   105,
   95,
   85,
   80,
   80,
   75,
   70,
   70,
   65,
   60,
   55,
   55,
   45,
   45,
   40,
   35,
   35,
   30,
   25,
   20,
   15,
   10
  ],
  "state_min": [
   630,
   620,
   510,
   385,
   320,
   285,
   245,
   55,
   55,
   25,
   65,
   45,
   5,
   5,
   10,
   40,
   20,
   25,
   30,
   5,
   5,
   10,
   5,
   15,
   5,
   10,
   10,
   10,
   5,
   5,
   5,
   0,
   0,
   0,
   5
  ],
  "arrival_mode": [
   0,
   0,
   0,
   1,
   0,
   0,
   0,
   0,
   0,
   0,
   0,
   0,
   1,
   0,
   0,
   1,
   0,
   0,
   0,
   1,
   0,
   0,
   0,
   0,
   0,
   1,
   0,
   0,
   0,
   0,
   0,
   0,
   0,
   0,
   0
  ],
  "age_band": [
   2,
   1,
   2,
   3,
   1,
   3,
   0,
   2,
   1,
   0,
   2,
   2,
   0,
   0,
   1,
   0,
   3,
   0,
   2,
   1,
   3,
   1,
   2,
   2,
   0,
   3,
   0,
   0,
   0,
   2,
   3,
   3,
   1,
   2,
   1
  ],
  "payer": [
   4,
   3,
   4,
   2,
   4,
   0,
   4,
   4,
   4,
   2,
   4,
   2,
   1,
   2,
   4,
   3,
   0,
   4,
   3,
   1,
   1,
   0,
   2,
   4,
   1,
   4,
   2,
   1,
   3,
   0,
   4,
   1,
   4,
   1,
   0
  ],
  "flags": [
   2,
   2,
   2,
   2,
   2,
   2,
   2,
   2,
   2,
   2,
   0,
   2,
   2,
   0,
   0,
   0,
   0,
   0,
   0,
   0,
   0,
   0,
   0,
   0,
   0,
   0,
   0,
   0,
   0,
   0,
   0,
   0,
   0,
   0,
   0
  ],
  "staff": [
   -1,
   -1,
   -1,
   -1,
   -1,
   -1,
   -1,
   -1,
   -1,
   -1,
   -1,
   -1,
   -1,
   -1,
   -1,
   -1,
   -1,
   -1,
   -1,
   -1,
   -1,
   -1,
   -1,
   -1,
   -1,
   -1,
   -1,
   -1,
   -1,
   -1,
   -1,
   -1,
   -1,
   -1,
   -1
  ]
 },
 "staff": {
  "id": [
   "MD-01",
   "MD-02",
   "MD-03",
   "MD-04",
   "RN-01",
   "RN-02",
   "RN-03",
   "RN-04",
   "RN-05",
   "RN-06",
   "RN-07",
   "RN-08",
   "RN-09",
   "RN-10",
   "TECH-01",
   "REG-01"
  ],
  "name": [
   null,
   null,
   null,
   null,
   null,
   null,
   null,
   null,
   null,
   null,
   null,
   null,
   null,
   null,
   null,
   null
  ],
  "role": [
   0,
   0,
   0,
   0,
   3,
   3,
   3,
   3,
   3,
   3,
   3,
   3,
   3,
   3,
   5,
   6
  ],
  "state": [
   2,
   2,
   2,
   2,
   2,
   2,
   2,
   2,
   2,
   2,
   2,
   2,
   2,
   2,
   1,
   1
  ],
  "room": [
   30,
   28,
   27,
   19,
   18,
   32,
   24,
   23,
   19,
   19,
   15,
   29,
   35,
   14,
   11,
   0
  ],
  "x": [
   62.1,
   53.7,
   49.5,
   49.5,
   45.3,
   6.9,
   36.9,
   66.3,
   49.5,
   49.5,
   76.9,
   57.9,
   19.5,
   69.9,
   62.9,
   10.9
  ],
  "z": [
   49.1,
   49.1,
   49.1,
   35.1,
   35.1,
   27.1,
   49.1,
   35.1,
   35.1,
   35.1,
   53.1,
   49.1,
   27.1,
   53.1,
   21.1,
   61.1
  ],
  "patient": [
   -1,
   -1,
   -1,
   -1,
   -1,
   -1,
   -1,
   -1,
   -1,
   -1,
   -1,
   -1,
   -1,
   -1,
   -1,
   -1
  ],
  "fatigue": [
   0.2,
   0.22,
   0.24,
   0.26,
   0.28,
   0.3,
   0.32,
   0.34,
   0.36,
   0.38,
   0.4,
   0.42,
   0.44,
   0.46,
   0.48,
   0.5
  ]
 },
 "rooms": {
  "status": [
   1,
   2,
   2,
   1,
   1,
   1,
   1,
   1,
   1,
   1,
   2,
   1,
   2,
   1,
   1,
   2,
   2,
   2,
   2,
   2,
   2,
   2,
   2,
   2,
   2,
   1,
   2,
   2,
   2,
   2,
   1,
   1,
   2,
   2,
   2,
   2
  ],
  "occupancy": [
   0,
   2,
   2,
   0,
   0,
   0,
   0,
   0,
   0,
   0,
   1,
   0,
   12,
   0,
   0,
   1,
   1,
   1,
   1,
   1,
   1,
   1,
   1,
   1,
   1,
   0,
   1,
   1,
   1,
   1,
   0,
   0,
   1,
   1,
   1,
   1
  ],
  "queue": [
   0,
   0,
   0,
   0,
   0,
   0,
   0,
   0,
   0,
   0,
   0,
   0,
   0,
   0,
   0,
   0,
   0,
   0,
   0,
   0,
   0,
   0,
   0,
   0,
   0,
   0,
   0,
   0,
   0,
   0,
   0,
   0,
   0,
   0,
   0,
   0
  ]
 },
 "equipment": {
  "status": [
   0,
   1
  ]
 },
 "ambulances": [],
 "kpis": {
  "settings": {
   "priority_rule": 1,
   "overflow_bays": 0,
   "divert": 0,
   "call_in": 0,
   "fast_track": 1,
   "provider_split": 1,
   "md_day": 2,
   "md_evening": 2,
   "md_night": 2,
   "rn_day": 2,
   "rn_evening": 2,
   "rn_night": 2,
   "triage_nurses": 1,
   "admission_cap": 0,
   "discharge_push": 0,
   "agency_contract": 0,
   "imaging_hours": 1,
   "bays_delta": 1,
   "ward_beds_delta": 1,
   "equipment_buy": 0,
   "relocate": 0,
   "headcount": 1
  },
  "ed_census": 22,
  "waiting_count": 8,
  "wait_p95_min": 60,
  "wait_mean_min": 43.6,
  "bay_occupancy": 0.783,
  "lwbs_rate": 0.02,
  "margin": 0
 },
 "events": [],
 "decisions": []
}